{"$schema":"https://json-schema.org/draft/2020-12/schema","$id":"https://github.com/haitaowu12/personal-growth-copilot/technique-registry.schema.json","title":"Personal Growth Copilot governed technique registry","type":"object","additionalProperties":false,"required":["schema_version","ontology","status","techniques"],"properties":{"schema_version":{"const":"1.0"},"status":{"const":"candidate"},"ontology":{"type":"object","additionalProperties":false,"required":["name","homepage","evidence_source_id","mapping_policy"],"properties":{"name":{"const":"Behaviour Change Intervention Ontology"},"homepage":{"type":"string","format":"uri","pattern":"^https://"},"evidence_source_id":{"type":"string","minLength":1},"mapping_policy":{"type":"string","minLength":1,"maxLength":1000}}},"techniques":{"type":"array","minItems":8,"maxItems":50,"items":{"$ref":"#/$defs/technique"}}},"$defs":{"barrier":{"enum":["clarity","capability","opportunity","motivation","initiation","persistence","feedback","recovery"]},"technique":{"type":"object","additionalProperties":false,"required":["id","label","bcio_id","bcio_label","candidate_barriers","eligibility_conditions","contraindications","minimum_burden","expected_proximal_signal","disconfirming_signal","review_window","evidence_source_ids","alternatives","requires_user_choice","efficacy_claim","status"],"properties":{"id":{"type":"string","pattern":"^PGC-BCT-[0-9]{3}$"},"label":{"type":"string","minLength":1,"maxLength":200},"bcio_id":{"type":"string","pattern":"^BCIO:[0-9]{6}$"},"bcio_label":{"type":"string","minLength":1,"maxLength":200},"candidate_barriers":{"type":"array","minItems":1,"maxItems":8,"uniqueItems":true,"items":{"$ref":"#/$defs/barrier"}},"eligibility_conditions":{"type":"array","minItems":1,"maxItems":10,"items":{"type":"string","minLength":1,"maxLength":500}},"contraindications":{"type":"array","minItems":1,"maxItems":10,"items":{"type":"string","minLength":1,"maxLength":500}},"minimum_burden":{"type":"string","minLength":1,"maxLength":500},"expected_proximal_signal":{"type":"string","minLength":1,"maxLength":700},"disconfirming_signal":{"type":"string","minLength":1,"maxLength":700},"review_window":{"type":"object","additionalProperties":false,"required":["kind","value"],"properties":{"kind":{"enum":["days","attempts","event"]},"value":{"oneOf":[{"type":"integer","minimum":1,"maximum":90},{"type":"string","minLength":1,"maxLength":300}]}}},"evidence_source_ids":{"type":"array","minItems":1,"maxItems":10,"uniqueItems":true,"items":{"type":"string","minLength":1,"maxLength":128}},"alternatives":{"type":"array","minItems":1,"maxItems":10,"uniqueItems":true,"items":{"type":"string","pattern":"^PGC-BCT-[0-9]{3}$"}},"requires_user_choice":{"const":true},"efficacy_claim":{"const":"not_established_for_this_product"},"status":{"const":"candidate"}}}}}
