{"schema_version":"1.0","status":"candidate","ontology":{"name":"Behaviour Change Intervention Ontology","homepage":"https://www.bciontology.org/","evidence_source_id":"bcto-2023-ontology","mapping_policy":"BCIO identifiers name intervention content. Mapping does not establish effectiveness, user fit, or product efficacy."},"techniques":[{"id":"PGC-BCT-001","label":"Goal strategising","bcio_id":"BCIO:007008","bcio_label":"goal strategising BCT","candidate_barriers":["clarity","opportunity","motivation"],"eligibility_conditions":["The user endorses a direction but lacks a feasible route.","Comparing strategies could change the next action."],"contraindications":["Do not turn a values conflict or professional determination into a productivity problem.","Stop after a feasible path is selected."],"minimum_burden":"Name one barrier and compare at most three strategies.","expected_proximal_signal":"The user identifies which strategy fits the barrier and why.","disconfirming_signal":"The strategies add options without improving the decision.","review_window":{"kind":"event","value":"before selecting the next experiment"},"evidence_source_ids":["michie-2013-bct-taxonomy","bcto-2023-ontology"],"alternatives":["PGC-BCT-002","PGC-BCT-005"],"requires_user_choice":true,"efficacy_claim":"not_established_for_this_product","status":"candidate"},{"id":"PGC-BCT-002","label":"Agree a behavioural goal","bcio_id":"BCIO:007004","bcio_label":"agree behaviour goal BCT","candidate_barriers":["clarity","motivation"],"eligibility_conditions":["The user wants and can choose a behavioural target.","The target is within the user’s authority."],"contraindications":["Do not force a target during exploration or when intentional non-action is valid.","Do not substitute the model’s preferred goal."],"minimum_burden":"Agree one behaviour and one review point.","expected_proximal_signal":"The user restates and endorses the target.","disconfirming_signal":"The user disowns the target or it narrows the decision prematurely.","review_window":{"kind":"event","value":"when the user accepts or rejects the goal"},"evidence_source_ids":["ryan-deci-2000-sdt","locke-latham-2002-goals","bcto-2023-ontology"],"alternatives":["PGC-BCT-001","PGC-BCT-008"],"requires_user_choice":true,"efficacy_claim":"not_established_for_this_product","status":"candidate"},{"id":"PGC-BCT-003","label":"Action planning","bcio_id":"BCIO:007010","bcio_label":"action planning BCT","candidate_barriers":["clarity","initiation","persistence"],"eligibility_conditions":["The user already intends to act.","Context or timing detail would reduce ambiguity."],"contraindications":["Do not use planning to conceal low commitment, missing authority, or inadequate capability.","Do not exceed the user’s burden budget."],"minimum_burden":"Specify the next context and minimum viable action.","expected_proximal_signal":"The user knows when, where, and how the first attempt starts.","disconfirming_signal":"Detail increases while expected initiation does not.","review_window":{"kind":"attempts","value":1},"evidence_source_ids":["gollwitzer-sheeran-2006-ifthen","bcto-2023-ontology"],"alternatives":["PGC-BCT-004","PGC-BCT-005"],"requires_user_choice":true,"efficacy_claim":"not_established_for_this_product","status":"candidate"},{"id":"PGC-BCT-004","label":"Prompt an intended action","bcio_id":"BCIO:007080","bcio_label":"prompt intended action BCT","candidate_barriers":["initiation","persistence"],"eligibility_conditions":["A user-owned intention exists.","A specific user-approved cue is available."],"contraindications":["Do not create reminders, notifications, or writes without separate authorization.","Do not use a cue when intention or capability is unresolved."],"minimum_burden":"Choose one existing or user-authorized cue.","expected_proximal_signal":"The cue makes the intended response easier to start.","disconfirming_signal":"The cue is ignored, creates nuisance, or fires when action is unavailable.","review_window":{"kind":"attempts","value":2},"evidence_source_ids":["gollwitzer-sheeran-2006-ifthen","bcto-2023-ontology"],"alternatives":["PGC-BCT-003","PGC-BCT-001"],"requires_user_choice":true,"efficacy_claim":"not_established_for_this_product","status":"candidate"},{"id":"PGC-BCT-005","label":"Instruct how to perform a behaviour","bcio_id":"BCIO:007058","bcio_label":"instruct how to perform a behaviour BCT","candidate_barriers":["capability","clarity"],"eligibility_conditions":["The user lacks procedural knowledge and accepts instruction.","The behaviour can be taught within product scope."],"contraindications":["Do not give out-of-scope professional or hazardous instruction.","Do not treat information as the solution when another barrier dominates."],"minimum_burden":"Give the smallest usable instruction and one check.","expected_proximal_signal":"The user can describe or demonstrate the next step.","disconfirming_signal":"The user knew the procedure or another barrier remains dominant.","review_window":{"kind":"event","value":"after one explanation or rehearsal"},"evidence_source_ids":["michie-2013-bct-taxonomy","bcto-2023-ontology"],"alternatives":["PGC-BCT-001","PGC-BCT-003"],"requires_user_choice":true,"efficacy_claim":"not_established_for_this_product","status":"candidate"},{"id":"PGC-BCT-006","label":"Self-monitor behaviour","bcio_id":"BCIO:007024","bcio_label":"self-monitor behaviour BCT","candidate_barriers":["feedback","persistence"],"eligibility_conditions":["The observation will inform a decision or experiment.","A low-burden observable measure exists."],"contraindications":["Do not use monitoring as surveillance or self-worth scoring.","Pause when tracking creates fixation, shame, or excess burden."],"minimum_burden":"Record one signal at the agreed event.","expected_proximal_signal":"The observation distinguishes explanations or informs adjustment.","disconfirming_signal":"The data do not change a decision or tracking distorts behaviour.","review_window":{"kind":"attempts","value":3},"evidence_source_ids":["harkin-2016-monitoring-meta","bcto-2023-ontology"],"alternatives":["PGC-BCT-008","PGC-BCT-003"],"requires_user_choice":true,"efficacy_claim":"not_established_for_this_product","status":"candidate"},{"id":"PGC-BCT-007","label":"Secure social support","bcio_id":"BCIO:007028","bcio_label":"social support BCT","candidate_barriers":["opportunity","persistence","recovery"],"eligibility_conditions":["A real person’s bounded help would address the barrier.","The user chooses the person and request."],"contraindications":["Do not pressure disclosure or assign an unsafe person.","Do not contact anyone without authorization or substitute the copilot for people."],"minimum_burden":"Identify one person and one bounded request.","expected_proximal_signal":"The request produces access, information, presence, or practical help.","disconfirming_signal":"The request increases risk or obligation without addressing the barrier.","review_window":{"kind":"event","value":"after the request or decision not to make it"},"evidence_source_ids":["michie-2013-bct-taxonomy","bcto-2023-ontology"],"alternatives":["PGC-BCT-001","PGC-BCT-005"],"requires_user_choice":true,"efficacy_claim":"not_established_for_this_product","status":"candidate"},{"id":"PGC-BCT-008","label":"Review a behavioural goal and plan","bcio_id":"BCIO:007299","bcio_label":"review behaviour goal plan BCT","candidate_barriers":["feedback","recovery","persistence"],"eligibility_conditions":["A user-owned goal or experiment reached its review event.","Observed evidence includes attempts and non-attempts."],"contraindications":["Do not infer decision quality from outcome alone.","Do not rewrite the original prediction after seeing the result."],"minimum_burden":"Compare prediction, action, observation, and one next change.","expected_proximal_signal":"The working model is retained, narrowed, superseded, or rejected for an evidence-linked reason.","disconfirming_signal":"The review preserves a self-sealing hypothesis or produces encouragement without learning.","review_window":{"kind":"event","value":"at the preregistered review point"},"evidence_source_ids":["tannenbaum-cerasoli-2013-debrief","harkin-2016-monitoring-meta","bcto-2023-ontology"],"alternatives":["PGC-BCT-006","PGC-BCT-001"],"requires_user_choice":true,"efficacy_claim":"not_established_for_this_product","status":"candidate"}]}
